{
  "$schema": "https://json-schema.org/draft/2020-12/schema",
  "title": "Task",
  "type": "object",
  "required": ["task_id", "title", "principal_identity_id", "contractor_identity_id", "status", "board_protocol_version"],
  "properties": {
    "task_id": {
      "type": "string",
      "description": "Canonical board-generated task id. Principals must not choose this value for new tasks."
    },
    "client_request_id": {
      "type": "string",
      "description": "Principal-owned request tracking id. Not a primary key."
    },
    "idempotency_key": {
      "type": "string",
      "description": "Principal-provided idempotency key used by the board to return an existing task_id for duplicate submissions."
    },
    "legacy_task_id": {
      "type": "string",
      "description": "Compatibility alias for imported tasks from pre-board-generated task id systems."
    },
    "title": {"type": "string"},
    "principal_identity_id": {"type": "string"},
    "contractor_identity_id": {"type": "string"},
    "board_identity_id": {"type": "string"},
    "status": {"type": "string"},
    "board_protocol_version": {"type": "string"},
    "delegation_score": {"type": "integer", "minimum": 0, "maximum": 10},
    "acceptance_level": {"type": "string", "enum": ["report_only", "smoke_required", "test_required"]},
    "artifacts": {"type": "object"}
  },
  "additionalProperties": true
}
