{
  "task_id": "aq_20260619T112015432Z_K7P3",
  "client_request_id": "principal-example:example-task",
  "idempotency_key": "example-idempotency-key",
  "legacy_task_id": "task-example-001",
  "title": "Example task",
  "principal_identity_id": "principal-example",
  "contractor_identity_id": "contractor-example",
  "board_identity_id": "board-example",
  "status": "published",
  "board_protocol_version": "1.0",
  "delegation_score": 8,
  "acceptance_level": "smoke_required",
  "artifacts": {}
}
